<?xml version="1.0" encoding="UTF-8"?>

<!--Подключение стороннего DTD-->
<!DOCTYPE catalog SYSTEM "catalog.dtd">


<catalog>
	<book isbn='456-123-45632'>
		<title>Название</title>
		<author>Автор</author>
		<price currency='RUR'>123.00</price>
		<publisher>BHV</publisher>
	</book>
	<book>
		<title>Название</title>
		<author>Автор</author>
		<price currency='RUR'>123.00</price>
	</book>
	<book isbn='736-738-9948'>
		<title>Название</title>
		<author>Автор</author>
    <author>Автор</author>
		<price currency='RUR'>123.00</price>
		<publisher>Williams</publisher>
	</book>
</catalog>

